{
  "record_id": "scu-mpa-2026-nonfull-econ-01",
  "school_id": "10610",
  "program_id": "scu-mpa-2026",
  "track_id": "scu-mpa-2026-econ-01",
  "school_name": "四川大学",
  "school_code": "10610",
  "school_label": "(10610)四川大学",
  "program_type": "MPA",
  "degree_type": "双证",
  "exam_type": "全国联考",
  "province": "四川",
  "city": "成都",
  "school_level": "985/211/双一流",
  "department_code": "101",
  "department_name": "经济学院",
  "department_label": "(101)经济学院",
  "department": "(101)经济学院",
  "major_category_code": "1252",
  "major_category_name": "公共管理",
  "major_category_label": "(1252)公共管理",
  "major_code": "125200",
  "major_name": "公共管理",
  "major_label": "(125200)公共管理",
  "direction": "公共经济与政府管理",
  "study_mode": "非全日制",
  "duration": 3,
  "tuition_min": 84000,
  "tuition_max": 84000,
  "class_time": "周末",
  "class_location": "成都市",
  "enrollment": 160,
  "exam_subjects": "199管理类综合能力+204英语(二)",
  "latest_score": "185/55/110",
  "score_year": 2026,
  "total_score": 185,
  "english_score": 55,
  "comprehensive_score": 110,
  "admission": "复207录170",
  "admission_rate": "82.10%",
  "admission_analysis": "拟录取人数较多，适合作为四川 MPA 重点对比项。",
  "retest_info": "复试：思想政治、管理综合。",
  "retest_info_by_year": {
    "2025": {
      "written_exam": "思想政治、管理综合",
      "interview_content": "",
      "interview_format": "",
      "score_calculation": "",
      "reference_books": "",
      "total_score_calculation": "",
      "notes": "同等学力加试科目及参考书以院校最新通知为准。"
    }
  },
  "first_choice_admission_by_year": {
    "2026": {
      "score_line": "185/55/110",
      "national_line_gap": "17/16/32",
      "retest_count": "",
      "admitted_count": "",
      "retest_admission_ratio": "",
      "admission_rate": "",
      "score_band_analysis": ""
    }
  },
  "adjustment_admission_by_year": {
    "2026": {
      "quota": 0,
      "rounds": "",
      "qualification_line": "",
      "first_choice_gap": "",
      "retest_count": "",
      "admitted_count": "",
      "retest_admission_ratio": "",
      "admission_rate": "",
      "score_band_analysis": ""
    }
  },
  "adjustment": "否",
  "interview": "否",
  "junior_college_allowed": "",
  "website": "",
  "logo_url": "https://t1.chei.com.cn/common/xh/10610.jpg",
  "description": "四川大学 MPA 项目，适合追求院校层次和体制内认可度的用户。",
  "tags": ["985", "211", "双一流", "非全日制", "周末班"],
  "source": {
    "source_file": "schoolData/sourceData/199exam/全量院校表_研招网主表补全.xlsx",
    "source_sheet": "全量院校表",
    "source_row": 2,
    "source_url": "",
    "batch_id": "2026-05-initial",
    "updated_at": "2026-05-14"
  },
  "quality": {
    "completeness_score": 0.92,
    "missing_fields": ["website"],
    "review_status": "reviewed",
    "publish_ready": true
  }
}
